{
  "version": 3,
  "project_id": "demo",
  "provider": "wan22",
  "profile": "smoke",
  "runtime": {"type": "kaggle"},
  "mode": "i2v",
  "stage": "demo",
  "provider_config": {
    "engine": "wan_native",
    "model": "Wan-AI/Wan2.2-TI2V-5B",
    "task": "ti2v-5B",
    "model_revision": "kaggle:ihsannika/wan2-2-ti2v-5b@dataset-9586885"
  },
  "runtime_plan": {
    "provider": "wan22",
    "runtime": "kaggle",
    "profile": "smoke",
    "execution": {
      "dtype": "float16",
      "resolution": "1280x704",
      "frame_num": 5,
      "fps": 24,
      "sample_steps": 8,
      "sample_shift": 5.0,
      "sample_solver": "unipc",
      "sample_guide_scale": 5.0,
      "t5_cpu": true,
      "offload_model": true,
      "dit_fsdp": false,
      "t5_fsdp": false,
      "ulysses_size": 1,
      "world_size": 1
    },
    "generated_duration_sec": 0.2083,
    "hardware": {"gpu_count": 0, "gpus": [], "ram_available_gib": 0.0, "software": {}, "detected": false},
    "hardware_basis": "unknown_conservative",
    "timeout": {"expected_runtime_sec": 120, "soft_timeout_sec": 180, "hard_timeout_sec": 270},
    "plan_digest": "7fc057930a6f4b24d0733ef25ac52a7837777430dc88bb923b3e5075313a6a05"
  },
  "jobs": [{
    "id": "S001",
    "image": "S001.png",
    "source_image_sha256": "93878ea0f239a4c7568a38b564c864a3912d57439b4c5861b501471ca5dee0e5",
    "prompt": "The subject remains consistent while the fabric and background atmosphere move gently. Slow cinematic push-in.",
    "negative_prompt": "",
    "constraints": ["preserve identity", "preserve composition", "no text or watermark"],
    "seed": 38123,
    "target_duration_sec": 10.0,
    "cache_key": "c323398f11997efa634105faa03b43f3a216c9292dffcc82e06b12df64225f88",
    "output": "output/S001.mp4",
    "fallback_asset": null
  }],
  "cache_hits": []
}
